{
  "$schema": "https://json-schema.org/draft/2020-12/schema",
  "$id": "https://dosquartsdedocs.github.io/unaltraweb/schemas/component-contract-v1.schema.json",
  "title": "unaltraweb component contract",
  "type": "object",
  "additionalProperties": false,
  "required": ["schema_version", "release", "consumer_integration", "receipt_contract", "wheel_contract", "components"],
  "properties": {
    "$schema": {"type": "string"},
    "schema_version": {"type": "integer", "const": 1},
    "release": {
      "type": "object",
      "additionalProperties": false,
      "required": ["version", "tag"],
      "properties": {
        "version": {"type": "string", "pattern": "^[0-9]+\\.[0-9]+\\.[0-9]+$"},
        "tag": {"type": "string", "pattern": "^v[0-9]+\\.[0-9]+\\.[0-9]+$"}
      }
    },
    "consumer_integration": {
      "type": "object",
      "additionalProperties": false,
      "required": ["schema_version", "core_repository", "core_sha", "site_deploy_workflow", "manual_pdf_image", "vegavisuals_sha"],
      "properties": {
        "schema_version": {"type": "integer", "const": 1},
        "core_repository": {"const": "https://github.com/dosquartsdedocs/unaltraweb.git"},
        "core_sha": {"type": "string", "minLength": 40, "maxLength": 40, "pattern": "^[0-9a-f]{40}$"},
        "core_gem_version": {"type": "string", "pattern": "^[0-9]+\\.[0-9]+\\.[0-9]+$"},
        "site_deploy_workflow": {"const": "dosquartsdedocs/unaltraweb/.github/workflows/site-deploy.yml"},
        "site_deploy_workflow_sha": {"type": "string", "minLength": 40, "maxLength": 40, "pattern": "^[0-9a-f]{40}$"},
        "manual_pdf_image": {"type": "string", "minLength": 117, "maxLength": 117, "pattern": "^ghcr\\.io/dosquartsdedocs/unaltraweb-manual-pdf@sha256:[0-9a-f]{64}$"},
        "vegavisuals_sha": {"type": "string", "minLength": 40, "maxLength": 40, "pattern": "^[0-9a-f]{40}$"}
      }
    },
    "deployment_contract": {
      "type": "object",
      "additionalProperties": false,
      "required": ["schema_version", "manual_pdf_workers", "caller_migrations"],
      "properties": {
        "schema_version": {"type": "integer", "const": 1},
        "manual_pdf_workers": {
          "type": "array", "minItems": 1, "uniqueItems": true,
          "items": {
            "type": "object", "additionalProperties": false,
            "required": ["reference", "producer_sha"],
            "properties": {
              "reference": {"type": "string", "minLength": 117, "maxLength": 117, "pattern": "^ghcr\\.io/dosquartsdedocs/unaltraweb-manual-pdf@sha256:[0-9a-f]{64}$"},
              "producer_sha": {"type": "string", "minLength": 40, "maxLength": 40, "pattern": "^[0-9a-f]{40}$"}
            }
          }
        },
        "caller_migrations": {
          "type": "array", "uniqueItems": true,
          "items": {
            "type": "object", "additionalProperties": false,
            "required": ["id", "path", "baseline_sha256", "current_sha256"],
            "properties": {
              "id": {"type": "string", "pattern": "^[a-z][a-z0-9-]{0,63}$"},
              "path": {"const": ".github/workflows/deploy.yml"},
              "baseline_sha256": {"type": "string", "minLength": 64, "maxLength": 64, "pattern": "^[0-9a-f]{64}$"},
              "current_sha256": {"type": "string", "minLength": 64, "maxLength": 64, "pattern": "^[0-9a-f]{64}$"}
            }
          }
        }
      }
    },
    "receipt_contract": {
      "type": "object",
      "additionalProperties": false,
      "required": ["schema_version", "path_template", "hash_algorithm", "input_inventory", "vegavisuals_dependencies", "diavisuals_dependencies", "local_dependency_policy", "unverifiable_dependency_policy"],
      "properties": {
        "schema_version": {"const": 1},
        "path_template": {"const": ".unaltraweb/receipts/{provider}.json"},
        "hash_algorithm": {"const": "sha256"},
        "input_inventory": {"const": "exact"},
        "vegavisuals_dependencies": {"const": ["manifest.inputs", "visualizations[].inputs", "spec.data.url"]},
        "diavisuals_dependencies": {"const": []},
        "local_dependency_policy": {"const": "project-relative-static-only"},
        "unverifiable_dependency_policy": {"const": "error"}
      }
    },
    "wheel_contract": {
      "type": "object",
      "additionalProperties": false,
      "required": ["package", "role", "package_only_commands", "factory_required_commands", "package_only_mcp", "factory_required_mcp", "not_bundled"],
      "properties": {
        "package": {"const": "unaltraweb-mcp"},
        "role": {"type": "string"},
        "package_only_commands": {"type": "array", "items": {"type": "string"}, "uniqueItems": true},
        "factory_required_commands": {"type": "array", "items": {"type": "string"}, "uniqueItems": true},
        "package_only_mcp": {"type": "array", "items": {"type": "string"}, "uniqueItems": true},
        "factory_required_mcp": {"type": "array", "items": {"type": "string"}, "uniqueItems": true},
        "not_bundled": {"type": "array", "items": {"type": "string"}, "uniqueItems": true}
      }
    },
    "components": {
      "type": "object",
      "required": ["gem", "wheel", "runtime", "mcp", "compute_python", "compute_r", "web_capture", "manual_pdf", "diavisuals", "vegavisuals"],
      "additionalProperties": {"$ref": "#/$defs/component"}
    }
  },
  "$defs": {
    "component": {
      "type": "object",
      "additionalProperties": false,
      "required": ["kind", "name", "version", "release", "release_status", "reference", "repository", "included_in_wheel", "features"],
      "properties": {
        "kind": {"enum": ["gem", "python-wheel", "container", "companion"]},
        "name": {"type": "string"},
        "version": {"type": "string", "pattern": "^[0-9]+\\.[0-9]+\\.[0-9]+$"},
        "release": {"type": "string", "pattern": "^v[0-9]+\\.[0-9]+\\.[0-9]+$"},
        "release_status": {"enum": ["released", "ready", "pending", "unavailable"]},
        "reference": {"type": "string"},
        "image_repository": {"type": "string", "pattern": "^ghcr\\.io/dosquartsdedocs/[a-z0-9._-]+$"},
        "repository": {"type": "string", "pattern": "^https://"},
        "included_in_wheel": {"type": "boolean"},
        "features": {"type": "array", "items": {"type": "string"}, "uniqueItems": true}
      }
    }
  }
}
