{
  "$schema": "component-contract.schema.json",
  "schema_version": 1,
  "release": {
    "version": "0.7.4",
    "tag": "v0.7.4"
  },
  "consumer_integration": {
    "schema_version": 1,
    "core_repository": "https://github.com/dosquartsdedocs/unaltraweb.git",
    "core_sha": "9d97197dec5fc9346ab795191a3afd18884c27fb",
    "site_deploy_workflow": "dosquartsdedocs/unaltraweb/.github/workflows/site-deploy.yml",
    "site_deploy_workflow_sha": "3332e0b93933f12317e05f1ce8d38ce80046feab",
    "manual_pdf_image": "ghcr.io/dosquartsdedocs/unaltraweb-manual-pdf@sha256:1bb3f2dafd741e96c28639ec1cc8ccaeb81cbaa73e649f787c0b4ef59997bd4b",
    "vegavisuals_sha": "a448cc50a5f511743a6fcfc213baeb9be80f4a27"
  },
  "deployment_contract": {
    "schema_version": 1,
    "manual_pdf_workers": [
      {
        "reference": "ghcr.io/dosquartsdedocs/unaltraweb-manual-pdf@sha256:9e0b3a45753c170b795e9a9d6df61580085c113436beac5bf6c8de69b6562097",
        "producer_sha": "d857f8c9f5fea90cf450c0b30b4e77a37b541275"
      },
      {
        "reference": "ghcr.io/dosquartsdedocs/unaltraweb-manual-pdf@sha256:0ba267cb87f53ebaca4e31805fe00610cd61fdf97a8d2c3692f4655700dceaed",
        "producer_sha": "5cf9817489c8dc47cee726bfe42fe3071cd32b85"
      },
      {
        "reference": "ghcr.io/dosquartsdedocs/unaltraweb-manual-pdf@sha256:1bb3f2dafd741e96c28639ec1cc8ccaeb81cbaa73e649f787c0b4ef59997bd4b",
        "producer_sha": "b7ec1d7a139c65b3b0b88699cdbeb19080f13be1"
      }
    ],
    "caller_migrations": [
      {
        "id": "deploy-provenance-86",
        "path": ".github/workflows/deploy.yml",
        "baseline_sha256": "a789870542614d5817d30ea4328c7d1ad38d27443c009c68a48ad5aaa3106b8e",
        "current_sha256": "c632a548d0782867be20a2a52fe03469cf63066b7364bace77fd54a226cb3b18"
      }
    ]
  },
  "receipt_contract": {
    "schema_version": 1,
    "path_template": ".unaltraweb/receipts/{provider}.json",
    "hash_algorithm": "sha256",
    "input_inventory": "exact",
    "vegavisuals_dependencies": ["manifest.inputs", "visualizations[].inputs", "spec.data.url"],
    "diavisuals_dependencies": [],
    "local_dependency_policy": "project-relative-static-only",
    "unverifiable_dependency_policy": "error"
  },
  "wheel_contract": {
    "package": "unaltraweb-mcp",
    "role": "Modular control, scaffolding, and offline inspection plane for unaltraweb sites.",
    "package_only_commands": ["doctor", "import-calibre", "new-web", "version"],
    "factory_required_commands": ["factory-dir"],
    "package_only_mcp": ["artifact-import-check", "import-artifact-bundle", "bibliography-add-entry", "bibliography-inventory", "build-health", "content-approval-inventory", "content-freshness-check", "content-inventory", "detect-site", "editorial-policy", "editorial-publication-check", "editorial-review-prepare", "editorial-review-record", "editorial-review-resolve", "editorial-status", "html-audit", "http-check", "image-background-check", "initialize-site", "language-policy", "list-tools", "manual-authoring-capabilities", "manual-editorial-quality-check", "manual-pdf-preview-clean", "manual-source-quality-check", "new-web", "preview-start", "preview-status", "preview-stop", "profile-check", "profile-prune", "profile-prune-plan", "prose-check", "scaffold-sync", "site-context", "site-doctor", "site-source-delete", "site-source-read", "site-source-write", "starter-templates", "translation-plan"],
    "factory_required_mcp": ["bibliometrics-check", "bibliometrics-fetch-scimago", "bibliometrics-update", "build-site", "manual-computation-check", "manual-computation-render", "manual-computation-render-figures", "manual-computation-status", "manual-pdf-build", "manual-pdf-preview-prepare", "manual-pdf-publish", "manual-pdf-status", "manual-practice-compose", "manual-practice-pdf-build", "manual-release-check", "manual-release-prepare", "manual-release-status", "prompts", "serve", "site-check", "web-capture-check", "web-capture-render", "web-capture-status"],
    "not_bundled": ["gem", "runtime", "mcp", "compute_python", "compute_r", "web_capture", "manual_pdf", "diavisuals", "vegavisuals", "qgis_practice_verifier"]
  },
  "components": {
    "gem": {
      "kind": "gem",
      "name": "unaltraweb",
      "version": "0.7.4",
      "release": "v0.7.4",
      "release_status": "ready",
      "reference": "unaltraweb (= 0.7.4)",
      "repository": "https://github.com/dosquartsdedocs/unaltraweb",
      "included_in_wheel": false,
      "features": ["jekyll-core", "site-build"]
    },
    "wheel": {
      "kind": "python-wheel",
      "name": "unaltraweb-mcp",
      "version": "0.7.4",
      "release": "v0.7.4",
      "release_status": "ready",
      "reference": "unaltraweb-mcp==0.7.4",
      "repository": "https://github.com/dosquartsdedocs/unaltraweb",
      "included_in_wheel": true,
      "features": ["calibre-import", "doctor", "new-web", "offline-inspection", "mcp-control-plane", "source-ci"]
    },
    "runtime": {
      "kind": "container",
      "name": "unaltraweb runtime",
      "version": "0.7.4",
      "release": "v0.7.4",
      "release_status": "ready",
      "reference": "ghcr.io/dosquartsdedocs/unaltraweb:0.7.4",
      "image_repository": "ghcr.io/dosquartsdedocs/unaltraweb",
      "repository": "https://github.com/dosquartsdedocs/unaltraweb",
      "included_in_wheel": false,
      "features": ["jekyll-runtime"]
    },
    "mcp": {
      "kind": "container",
      "name": "unaltraweb MCP runtime",
      "version": "0.7.4",
      "release": "v0.7.4",
      "release_status": "ready",
      "reference": "ghcr.io/dosquartsdedocs/unaltraweb-mcp:0.7.4",
      "image_repository": "ghcr.io/dosquartsdedocs/unaltraweb-mcp",
      "repository": "https://github.com/dosquartsdedocs/unaltraweb",
      "included_in_wheel": false,
      "features": ["mcp", "consumer-build", "preview"]
    },
    "compute_python": {
      "kind": "container",
      "name": "unaltraweb Python computation worker",
      "version": "0.4.0",
      "release": "v0.4.0",
      "release_status": "released",
      "reference": "ghcr.io/dosquartsdedocs/unaltraweb-compute-python@sha256:18cb269811bd4005800382da25a480ec2bca7eac8d0501ad1ef36bad1c0f8cd9",
      "image_repository": "ghcr.io/dosquartsdedocs/unaltraweb-compute-python",
      "repository": "https://github.com/dosquartsdedocs/unaltraweb",
      "included_in_wheel": false,
      "features": ["manual-computations", "python"]
    },
    "compute_r": {
      "kind": "container",
      "name": "unaltraweb R computation worker",
      "version": "0.4.0",
      "release": "v0.4.0",
      "release_status": "released",
      "reference": "ghcr.io/dosquartsdedocs/unaltraweb-compute-r@sha256:928ffb93f221e09e8b929157dee473b838e061915a2eb67224e4124b85f81837",
      "image_repository": "ghcr.io/dosquartsdedocs/unaltraweb-compute-r",
      "repository": "https://github.com/dosquartsdedocs/unaltraweb",
      "included_in_wheel": false,
      "features": ["manual-computations", "r"]
    },
    "web_capture": {
      "kind": "container",
      "name": "unaltraweb web capture worker",
      "version": "0.4.0",
      "release": "v0.4.0",
      "release_status": "released",
      "reference": "ghcr.io/dosquartsdedocs/unaltraweb-web-capture@sha256:0bf1bc67fe63e1440bffe708a168beefa11c54441650a871ab99380d362f7c1e",
      "image_repository": "ghcr.io/dosquartsdedocs/unaltraweb-web-capture",
      "repository": "https://github.com/dosquartsdedocs/unaltraweb",
      "included_in_wheel": false,
      "features": ["web-captures"]
    },
    "manual_pdf": {
      "kind": "container",
      "name": "unaltraweb manual PDF worker",
      "version": "0.7.1",
      "release": "v0.7.1",
      "release_status": "released",
      "reference": "ghcr.io/dosquartsdedocs/unaltraweb-manual-pdf@sha256:1bb3f2dafd741e96c28639ec1cc8ccaeb81cbaa73e649f787c0b4ef59997bd4b",
      "image_repository": "ghcr.io/dosquartsdedocs/unaltraweb-manual-pdf",
      "repository": "https://github.com/dosquartsdedocs/unaltraweb",
      "included_in_wheel": false,
      "features": ["manual-pdf"]
    },
    "qgis_practice_verifier": {
      "kind": "companion",
      "name": "unaltracaptura-qgis",
      "version": "0.6.1",
      "release": "v0.6.1",
      "release_status": "released",
      "reference": "https://github.com/dosquartsdedocs/unaltracaptura-qgis.git@v0.6.1",
      "repository": "https://github.com/dosquartsdedocs/unaltracaptura-qgis",
      "included_in_wheel": false,
      "features": ["qgis-practice-v1", "qgis-practice-v2", "private-prepared-runtime"]
    },
    "diavisuals": {
      "kind": "companion",
      "name": "diavisuals",
      "version": "0.5.0",
      "release": "v0.5.0",
      "release_status": "released",
      "reference": "https://github.com/dosquartsdedocs/diavisuals/releases/download/v0.5.0/diavisuals-0.5.0-py3-none-any.whl#sha256=f52e20f20f1fb3a2418f07adb8d6a68a5567d0c321fb7c0ccc0f4db04917b96b",
      "repository": "https://github.com/dosquartsdedocs/diavisuals",
      "included_in_wheel": false,
      "features": ["mermaid", "plantuml"]
    },
    "vegavisuals": {
      "kind": "companion",
      "name": "vegavisuals",
      "version": "0.5.1",
      "release": "v0.5.1",
      "release_status": "released",
      "reference": "https://github.com/dosquartsdedocs/vegavisuals/releases/download/v0.5.1/vegavisuals-0.5.1-py3-none-linux_x86_64.whl#sha256=5aba4f267a37179c520b3cd164e1cec62ac5561872aa33b069cce73442dc52b1",
      "repository": "https://github.com/dosquartsdedocs/vegavisuals",
      "included_in_wheel": false,
      "features": ["vega", "vega-lite"]
    }
  }
}
